{
  "acquisition": {
    "framePoolCapacity": 256,
    "queueCapacity": 128,
    "receiveTimeoutMs": 1000,
    "threadPriority": "normal"
  },
  "algorithm": {
    "candidateThreshold": 0.6,
    "confirmationThreshold": 0.8,
    "consecutiveFrames": 3,
    "cooldownMs": 1000,
    "debugOverlay": false,
    "device": "cpu",
    "enabled": false,
    "modelReference": "",
    "modelVersion": "",
    "roi": {
      "height": 1,
      "offsetX": 0,
      "offsetY": 0,
      "width": 1
    },
    "type": "mock"
  },
  "cameras": [
    {
      "enabled": true,
      "exposureUs": 4989.0,
      "frameRate": 59.0,
      "gainDb": -2.0,
      "id": "CAM01",
      "interPacketDelayNs": 400,
      "location": "安装工位",
      "packetSizeBytes": 1500,
      "pixelFormat": "BayerRG8",
      "roi": {
        "height": 1240,
        "offsetX": 0,
        "offsetY": 0,
        "width": 1623
      },
      "serialNumber": "DB1888674",
      "triggerDelayUs": 0,
      "triggerMode": "Continuous",
      "triggerSource": ""
    }
  ],
  "configRevision": 3,
  "configSchemaVersion": 1,
  "event": {
    "generatePreviewVideo": false,
    "keyFrameCount": 7,
    "maxEventSeconds": 60,
    "mergeGapSeconds": 3,
    "postEventSeconds": 10,
    "preEventSeconds": 10,
    "retentionDays": 30,
    "saveRaw": true,
    "uploadPolicy": "confirmed"
  },
  "health": {
    "cpuWarningPercent": 85.0,
    "droppedFrameWarningRatio": 0.01,
    "heartbeatStaleSeconds": 30,
    "memoryWarningPercent": 85.0,
    "sampleIntervalMs": 1000
  },
  "logging": {
    "directory": "data/logs",
    "level": "info",
    "maximumFileSizeMiB": 10,
    "maximumFilesPerDay": 5,
    "queueCapacity": 8192,
    "retentionDays": 30
  },
  "modifiedAt": "2026-08-03T07:09:12.507Z",
  "plantIo": {
    "adapterType": "disabled",
    "credentialReference": "",
    "enabled": false,
    "endpoint": "",
    "pollIntervalMs": 1000
  },
  "preview": {
    "enabled": true,
    "fps": 3.0,
    "jpegQuality": 80,
    "maxHeight": 720,
    "maxWidth": 1280
  },
  "storage": {
    "cacheRoot": "data/cache",
    "criticalFreeSpaceGiB": 100,
    "eventRoot": "data/事件 数据",
    "maximumEventStorageGiB": 1000,
    "stopFreeSpaceGiB": 20,
    "warningFreeSpaceGiB": 200
  },
  "system": {
    "machineId": "EDGE-001",
    "productionLineId": "PM-01",
    "shutdownTimeoutMs": 30000
  },
  "uplink": {
    "certificateReference": "",
    "credentialReference": "",
    "enabled": false,
    "heartbeatSeconds": 5,
    "serverUrl": ""
  }
}
